{
  "schemaVersion": "1.0-draft",
  "caseId": "GD-001",
  "synthetic": true,
  "description": "Fonte textual limpa com titular e fração sustentados por trechos exatos.",
  "source": {
    "id": "11111111-1111-4111-8111-111111111111",
    "version": 1,
    "sha256": "sha256:2b2a192052a275159aa364291e2a49c336dfc39cade9bdd462a9c35b137d0cf5",
    "nameSanitized": "gd-001-matricula-sintetica.pdf",
    "mimeType": "application/pdf",
    "byteLength": 1024
  },
  "pages": [
    {
      "number": 1,
      "text": "R-1 - Pessoa Alfa adquiriu a fração ideal de 1/2.",
      "textSha256": "sha256:97198438fe7ce67503110a3825e5e5fc0b23de48b54e6cd1cb8f637c85160cfc",
      "strategy": "native_text",
      "quality": "high"
    }
  ],
  "acts": [
    {
      "id": "11111111-1111-4111-8111-111111111101",
      "order": 1,
      "identifier": "R-1",
      "declaredType": "registration",
      "pages": [1],
      "fields": [
        {
          "path": "holder.name",
          "valueType": "identity",
          "suggestedValue": "Pessoa Alfa",
          "state": "confirmed",
          "evidences": [
            {
              "sourceId": "11111111-1111-4111-8111-111111111111",
              "sourceVersion": 1,
              "sourceSha256": "sha256:2b2a192052a275159aa364291e2a49c336dfc39cade9bdd462a9c35b137d0cf5",
              "page": 1,
              "textSha256": "sha256:97198438fe7ce67503110a3825e5e5fc0b23de48b54e6cd1cb8f637c85160cfc",
              "startUtf16": 6,
              "endUtf16": 17,
              "excerpt": "Pessoa Alfa"
            }
          ]
        },
        {
          "path": "right.fraction",
          "valueType": "fraction",
          "suggestedValue": { "numerator": 1, "denominator": 2 },
          "state": "confirmed",
          "evidences": [
            {
              "sourceId": "11111111-1111-4111-8111-111111111111",
              "sourceVersion": 1,
              "sourceSha256": "sha256:2b2a192052a275159aa364291e2a49c336dfc39cade9bdd462a9c35b137d0cf5",
              "page": 1,
              "textSha256": "sha256:97198438fe7ce67503110a3825e5e5fc0b23de48b54e6cd1cb8f637c85160cfc",
              "startUtf16": 45,
              "endUtf16": 48,
              "excerpt": "1/2"
            }
          ]
        }
      ],
      "relations": [],
      "issues": []
    }
  ],
  "reviews": [
    {
      "id": "11111111-1111-4111-8111-111111111201",
      "actId": "11111111-1111-4111-8111-111111111101",
      "fieldPath": "right.fraction",
      "decision": "confirmed",
      "finalValue": { "numerator": 1, "denominator": 2 },
      "justification": null,
      "reviewerId": "11111111-1111-4111-8111-111111111301"
    }
  ],
  "scenario": null,
  "expected": {
    "status": "consistent_in_scope",
    "projectionAllowed": false,
    "findings": []
  }
}
